{
  "run_id": "1b46552b-3b20-4000-82c1-affb800d9ad7",
  "repo_fingerprint": "sha256:9ac488485e5b0dc9bdbb81718846bf1d1d1e4019204a90a4d0673707210b0067",
  "matrix_cells": [
    "hygiene"
  ],
  "findings": [
    {
      "check_id": "gitignore_present",
      "artifact": "hygiene",
      "confidence": 1.0,
      "passed": true,
      "severity": "info",
      "detail": ".gitignore is present at the repository root."
    },
    {
      "check_id": "gitignore_coverage",
      "artifact": "hygiene",
      "confidence": 1.0,
      "passed": true,
      "severity": "info",
      "detail": ".gitignore covers common secret and junk patterns."
    },
    {
      "check_id": "sensitive_filenames",
      "artifact": "hygiene",
      "confidence": 1.0,
      "passed": true,
      "severity": "info",
      "detail": "No sensitive-looking filenames detected in the repository tree."
    },
    {
      "check_id": "no_vendored_binary_bulk",
      "artifact": "hygiene",
      "confidence": 1.0,
      "passed": true,
      "severity": "info",
      "detail": "No unexpected vendored or binary bulk detected."
    },
    {
      "check_id": "readme_nontrivial",
      "artifact": "hygiene",
      "confidence": 1.0,
      "passed": true,
      "severity": "info",
      "detail": "README.md is present and has meaningful content."
    },
    {
      "check_id": "licence_present",
      "artifact": "hygiene",
      "confidence": 1.0,
      "passed": true,
      "severity": "info",
      "detail": "Licence file is present at the repository root."
    },
    {
      "check_id": "top_level_structure",
      "artifact": "hygiene",
      "confidence": 1.0,
      "passed": true,
      "severity": "info",
      "detail": "Top-level directory structure looks coherent."
    }
  ],
  "tokens_spent": 0,
  "script_versions": {
    "hygiene": "0.1.0",
    "run_record_schema": "1.1.0"
  },
  "previous_run": "845bb09b-612d-4000-8d29-6cd528e9f91e",
  "cohort_ref": "v0.1-tier-a",
  "created_at": "2026-07-18T10:24:09.712592Z",
  "execution_context": {
    "model": null,
    "cli_version": "hygiene.py/0.1.0 (python 3.12.3)",
    "entitlement_type": null
  },
  "dispute": null,
  "correction": null,
  "wall_clock_seconds": 0.022,
  "github_api_requests": 0,
  "files_inspected": 395,
  "bytes_inspected": 5253194,
  "checks_passed": 7,
  "checks_total": 7,
  "ruleset_version": "hygiene/0.1.0",
  "commit_sha": "e2f94593d7087b890f6dc7b28ae9602371fd3994"
}
